{
  "company": {
    "name": "Millenium Coop Initiative",
    "slogan": "Des sites web pour les coopératives agricoles",
    "mission": "Millenium Coop Initiative s'inscrit dans la dynamique des Objectifs de Développement Durable (ODD) de l'ONU. En connectant nos producteurs au web, nous créons un levier d'émancipation économique, de sécurité alimentaire et d'inclusion sociale directement à Afféry et Adzopé.",
    "phone": "05 74 97 10 22",
    "whatsapp": "05 74 97 10 22",
    "email": "",
    "address": "Afféry / Adzopé, Côte d'Ivoire",
    "social": {
      "whatsapp": "https://wa.me/2250574971022"
    }
  },
  "hero": {
    "slides": [
      {
        "title": "Transformer le potentiel local en présence digitale durable",
        "subtitle": "Des sites web pour les coopératives agricoles en Côte d'Ivoire",
        "cta": "Découvrir nos services",
        "image": "/assets/placeholder-hero.jpg"
      }
    ]
  },
  "services": [
    {
      "id": "conseil",
      "title": "Conseil & Stratégie Digitale",
      "description": "Diagnostic numérique, définition d'une feuille de route adaptée à vos objectifs, gouvernance des données, communication digitale et accompagnement stratégique.",
      "icon": "fa-chart-line"
    },
    {
      "id": "solutions",
      "title": "Solutions Numériques",
      "description": "Création de sites web vitrines et institutionnels, plateformes métier, digitalisation des processus internes, automatisation et intégration d'outils.",
      "icon": "fa-code"
    },
    {
      "id": "formation",
      "title": "Accompagnement & Formation",
      "description": "Formation des référents locaux, transfert de compétences, support de proximité pendant 3 mois, accompagnement au changement et à l'appropriation des outils.",
      "icon": "fa-graduation-cap"
    }
  ],
  "projects": [
    {
      "id": "cooperatives-affery",
      "title": "Transformation digitale de 4 coopératives agricoles",
      "subtitle": "Zone Afféry / Adzopé, Côte d'Ivoire",
      "context": "Les coopératives de la zone ne disposaient d'aucune présence en ligne, ce qui limitait leur visibilité auprès des partenaires et institutions.",
      "challenge": "Réaliser 4 sites web professionnels en seulement 3 jours de mission sur le terrain.",
      "solution": "Préparation en amont (collecte des contenus par Franck), développement d'un template commun personnalisé, mission intensive de 3 jours pour finaliser, former et déployer.",
      "results": "4 sites en ligne, 1 référent local formé, 3 mois de support inclus.",
      "image": "/assets/placeholder-case-study.jpg"
    }
  ],
  "team": [
    {
      "name": "Guisso Franck",
      "role": "Chargé de mobilisation locale",
      "description": "Millenium Coop Initiative — Des sites web pour les coopératives agricoles — Web & Développement Durable | Zone Afféry - Adzopé. Assure la mobilisation, la collecte, la logistique et le support local.",
      "photo": "/assets/placeholder-guiss.jpg"
    },
    {
      "name": "Oulaï Sieni",
      "role": "Consultant Digital & Formateur Technique",
      "description": "Expert en développement web et formation. Conçoit les solutions, développe, forme et déploie.",
      "photo": "/assets/placeholder-sieni.jpg"
    }
  ],
  "testimonials": [],
  "partners": [],
  "i18n": {
    "defaultLanguage": "fr",
    "fr": {
      "menu": {
        "home": "Accueil",
        "services": "Services",
        "projects": "Réalisations",
        "team": "Équipe",
        "contact": "Contact"
      }
    },
    "en": {
      "menu": {
        "home": "Home",
        "services": "Services",
        "projects": "Projects",
        "team": "Team",
        "contact": "Contact"
      }
    }
  }
}